{
  "$schema": "https://json-schema.org/draft/2020-12/schema",
  "$id": "https://classquest.app/schema/course-graph.schema.json",
  "title": "CourseGraph",
  "description": "Stage 2 output. The learning-objective graph extracted from uploaded course content. This is the intermediate representation the whole system rests on: it is the input to narrative planning, the vocabulary for scene generation, and the blueprint for assessment. Produced by one structured-output call over the ingested document.",
  "type": "object",
  "additionalProperties": false,
  "required": ["schema_version", "graph_id", "source", "concepts"],
  "properties": {
    "schema_version": { "const": "1.0" },
    "graph_id": {
      "type": "string",
      "pattern": "^[a-z0-9]{8,32}$",
      "description": "Stable id. Games reference this so a regenerated game can be traced to the extraction it came from."
    },
    "source": {
      "type": "object",
      "additionalProperties": false,
      "required": ["title", "segment_count"],
      "properties": {
        "title": { "type": "string", "maxLength": 200 },
        "segment_count": {
          "type": "integer",
          "minimum": 1,
          "description": "How many chunks ingestion produced. Every source_span segment_id must be less than this."
        }
      }
    },
    "concepts": {
      "type": "array",
      "minItems": 3,
      "maxItems": 40,
      "description": "Upper bound is a cost guardrail, not a pedagogical claim. Long documents are extracted section by section.",
      "items": { "$ref": "#/$defs/concept" }
    }
  },
  "$defs": {
    "concept_id": {
      "type": "string",
      "pattern": "^[a-z0-9_]{2,48}$",
      "description": "Slug derived from the label. Must be unique within the graph."
    },
    "concept": {
      "type": "object",
      "additionalProperties": false,
      "required": ["id", "label", "summary", "bloom_level", "prerequisites", "source_spans", "misconceptions"],
      "properties": {
        "id": { "$ref": "#/$defs/concept_id" },
        "label": {
          "type": "string",
          "maxLength": 80,
          "description": "Human readable name as it appears to the learner."
        },
        "summary": {
          "type": "string",
          "maxLength": 400,
          "description": "One or two plain sentences. This is what the learner must end up understanding, not a definition copied from the source."
        },
        "bloom_level": {
          "enum": ["remember", "understand", "apply", "analyse", "evaluate", "create"],
          "description": "Drives which scene mechanic is appropriate. remember and understand map to dialogue plus prediction; apply and above map to simulation."
        },
        "prerequisites": {
          "type": "array",
          "maxItems": 8,
          "uniqueItems": true,
          "items": { "$ref": "#/$defs/concept_id" },
          "description": "Concepts that must be taught before this one. Must be acyclic. The narrative planner topologically sorts on this field, so a cycle is a hard failure, not a warning."
        },
        "source_spans": {
          "type": "array",
          "minItems": 1,
          "maxItems": 6,
          "items": { "$ref": "#/$defs/source_span" },
          "description": "Grounding. Every concept must point at the text it came from. A concept with no span is a hallucination and is dropped."
        },
        "misconceptions": {
          "type": "array",
          "minItems": 1,
          "maxItems": 4,
          "items": { "$ref": "#/$defs/misconception" },
          "description": "The highest value field in the schema. These become the distractors in prediction scenes. Plausible wrong beliefs a learner actually holds, not arbitrary wrong answers."
        }
      }
    },
    "source_span": {
      "type": "object",
      "additionalProperties": false,
      "required": ["segment_id", "quote"],
      "properties": {
        "segment_id": { "type": "integer", "minimum": 0 },
        "quote": {
          "type": "string",
          "maxLength": 300,
          "description": "Verbatim text from the segment. Validation checks this string actually occurs in the segment. If it does not, the concept is rejected."
        }
      }
    },
    "misconception": {
      "type": "object",
      "additionalProperties": false,
      "required": ["id", "statement", "why_plausible", "correction"],
      "properties": {
        "id": { "type": "string", "pattern": "^[a-z0-9_]{2,48}$" },
        "statement": {
          "type": "string",
          "maxLength": 200,
          "description": "The wrong belief, written in the learner's voice as something they would actually think."
        },
        "why_plausible": {
          "type": "string",
          "maxLength": 300,
          "description": "Why a reasonable learner lands here. Used to write the reveal text so the correction addresses the actual reasoning error."
        },
        "correction": {
          "type": "string",
          "maxLength": 300,
          "description": "What is actually true and why. Shown after the learner commits."
        }
      }
    }
  }
}
